0;question;question_ru
5670;Find the name of amenities Smith Hall dorm have. ordered the results by amenity names.;Найдите название удобств, которые есть в Смит -Холле. Заказал результаты по именам удобств.
5671;What amenities does Smith Hall have in alphabetical order?;Какие удобства у Смита Холла в алфавитном порядке?
5680;Find the first and last name of students who are living in the dorms that have amenity TV Lounge.;Найдите первую и фамилию студентов, которые живут в общежитии, где есть телевизионный зал.
5681;What are the first and last names of all students who are living in a dorm with a TV Lounge?;Каковы первые и фамилии всех студентов, которые живут в общежитии с телевизионным залом?
5682;Find the first name and age of students who are living in the dorms that do not have amenity TV Lounge.;Найдите имя и возраст студентов, которые живут в общежитии, у которых нет удобства телевизионного зала.
5683;What is the first name and age of every student who lives in a dorm with a TV Lounge?;Какое имя и возраст каждого ученика, который живет в общежитии с телевизионным залом?
5684;Find the name of amenities of the dorm where the student with last name Smith is living in.;Найдите название удобств общежития, где живет студент с фамилией Смит.
5685;What are the amenities in the dorm that a student who has the last name of Smith lives in?;Каковы удобства в общежитии, в котором живет студент, в котором находится фамилия Смита?
5686;How many customers are there?;Сколько там клиентов?
5687;Count the number of customers.;Подсчитайте количество клиентов.
5688;Find the emails and phone numbers of all the customers, ordered by email address and phone number.;Найдите электронные письма и номера телефонов всех клиентов, заказанные по адресу электронной почты и номером телефона.
5689;What are the emails and phone numbers of all customers, sorted by email address and phone number?;Каковы электронные письма и номера телефонов всех клиентов, отсортированные по адресу электронной почты и номером телефона?
5690;"Which city has the least number of customers whose type code is ""Good Credit Rating""?";В каком городе есть наименьшее количество клиентов, чей код типа «хороший кредитный рейтинг»?
5691;"Return the city with the customer type code ""Good Credit Rating"" that had the fewest customers.";Верните город с помощью кода типа клиента «Хороший кредитный рейтинг», в котором было наименьшее количество клиентов.
5704;"What is the description of the product named ""Chocolate""?";Какое описание продукта под названием «Шоколад»?
5705;"Return the description of the product called ""Chocolate"".";Верните описание продукта под названием «шоколад».
5706;Find the name and category of the most expensive product.;Найдите название и категорию самого дорогого продукта.
5707;What is the name and category code of the product with the highest price?;Каково название и категория кода продукта по самой высокой цене?
5710;What is the average price of the products for each category?;Какова средняя цена продукции для каждой категории?
5711;Return the average price of products that have each category code.;Верните среднюю цену продуктов, которые имеют каждую категорию.
5716;"Find the last name of the staff whose email address contains ""wrau"".";Найдите фамилию персонала, чей адрес электронной почты содержит «Wroau».
5717;"What are the last names of staff with email addressed containing the substring ""wrau""?";"Каковы фамилии персонала с адресом электронной почты, содержащей подстроение ""Wroau""?"
5718;How many customers are there in the customer type with the most customers?;Сколько клиентов в типе клиента с большинством клиентов?
5719;Count the number of customers that have the customer type that is most common.;Подсчитайте количество клиентов, у которых есть тип клиента, который является наиболее распространенным.
5724;"Find the address line 1 and 2 of the customer with email ""vbogisich@example.org"".";"Найдите адресную строку 1 и 2 клиента с электронной почтой ""vbogisich@example.org""."
5725;"What are lines 1 and 2 of the addressed of the customer with the email ""vbogisich@example.org""?";"Каковы строки 1 и 2 адресата клиента с электронной почтой ""vbogisich@example.org""?"
5730;Which state has the most customers?;В каком штате больше клиентов?
5731;Give the state that has the most customers.;Дайте государству, в котором больше клиентов.
5732;How many submissions are there?;Сколько существует заявок?
5733;Count the number of submissions.;Подсчитайте количество материалов.
5734;List the authors of submissions in ascending order of scores.;Перечислите авторов представлений в порядке восходящего порядка результатов.
5735;Find the author for each submission and list them in ascending order of submission score.;Найдите автора для каждого представления и перечислите его в восходящем порядке по оценке отправки.
5736;What are the authors of submissions and their colleges?;Каковы авторы материалов и их колледжей?
5737;For each submission, show the author and their affiliated college.;За каждое представление покажите автору и их аффилированный колледж.
5738;"Show the names of authors from college ""Florida"" or ""Temple""";"Покажите имена авторов из колледжа ""Флорида"" или ""Храм"""
5739;"Which authors with submissions are from college ""Florida"" or ""Temple""?";Какие авторы с представлениями из колледжа «Флорида» или «Храмовой»?
5740;What is the average score of submissions?;Какова средняя оценка представлений?
5741;Compute the average score of submissions.;Вычислить средний балл материалов.
5742;What is the author of the submission with the highest score?;Каков автор подчинения с самым высоким баллом?
5743;Find the author who achieved the highest score in a submission.;Найдите автора, который достиг наивысшего балла в подчинении.
5744;Show different colleges along with the number of authors of submission from each college.;Покажите разные колледжи, а также количество авторов подчинения из каждого колледжа.
5745;For each college, return the college name and the count of authors with submissions from that college.;Для каждого колледжа верните название колледжа и подсчет авторов с представлениями из этого колледжа.
5746;Show the most common college of authors of submissions.;Показать самый распространенный колледж авторов представлений.
5747;Which college has the most authors with submissions?;В каком колледже большинство авторов с представлениями?
5750;Show the authors of submissions and the acceptance results of their submissions.;Покажите авторам представлений и результатов принятия их представлений.
5751;For each submission, find its author and acceptance result.;Для каждого представления найдите его автора и результат принятия.
5752;Show the result of the submission with the highest score.;Покажите результат представления с самым высоким баллом.
5753;Which submission received the highest score in acceptance result. Show me the result.;Какое представление получило самый высокий балл в результате принятия. Покажи мне результат.
5754;Show each author and the number of workshops they submitted to.;Покажите каждому автору и количество семинаров, на которые они представлены.
5755;How many workshops did each author submit to? Return the author name and the number of workshops.;Сколько семинаров представило каждый автор? Верните имя автора и количество семинаров.
5756;Show the authors who have submissions to more than one workshop.;Покажите авторам, у которых есть представления на более чем одну семинар.
5757;Which authors have submitted to more than one workshop?;Какие авторы отправились на более чем одну семинар?
5758;Show the date and venue of each workshop in ascending alphabetical order of the venue.;Покажите дату и место проведения каждого семинара в восходящем алфавитном порядке места проведения.
5759;Sort the each workshop in alphabetical order of the venue. Return the date and venue of each workshop.;Сортируйте каждую семинар в алфавитном порядке места встречи. Верните дату и место проведения каждого семинара.
5762;Find the number of investors in total.;Найдите количество инвесторов в общей сложности.
5763;Show all investor details.;Показать все детали инвестора.
5764;Show all distinct lot details.;Покажите все отличные детали лота.
5771;"Show the description of transaction type with code ""PUR"".";Покажите описание типа транзакции с кодом «pur».
5778;Return the lot details and investor ids.;Вернуть детали лота и идентификаторы инвесторов.
5779;"Return the lot details of lots that belong to investors with details ""l""?";Вернуть детали участка лотов, которые принадлежат инвесторам с деталями «L»?
5803;How many available hotels are there in total?;Сколько доступных отелей в общей сложности?
5804;Find the total number of available hotels.;Найдите общее количество доступных отелей.
5805;What are the price ranges of hotels?;Каковы диапазоны цен на отели?
5806;Tell me the price ranges for all the hotels.;Расскажите мне, что ценовые диапазоны для всех отелей.
5807;Show all distinct location names.;Покажите все различные названия местоположения.
5808;What are the distinct location names?;Каковы отличные названия местоположения?
5809;Show the names and details of all the staff members.;Покажите имена и детали всех сотрудников.
5810;What is the name and detail of each staff member?;Как называется и детали каждого сотрудника?
5811;Show details of all visitors.;Покажите подробности всех посетителей.
5812;What is the detail of each visitor?;Каковы детали каждого посетителя?
5813;Show the price ranges of hotels with 5 star ratings.;Покажите ценовые диапазоны отелей с 5 звездными рейтингами.
5814;What are the price ranges of five star hotels?;Какие ценовые диапазоны пятизвездочных отелей?
5815;Show the average price range of hotels that have 5 star ratings and allow pets.;Покажите средний ценовой диапазон отелей, которые имеют 5 звездных рейтингов и позволяют домашним животным.
5816;What is the average price range of five star hotels that allow pets?;Каков средний ценовой диапазон пятизвездочных отелей, которые позволяют домашним животным?
5817;"What is the address of the location ""UK Gallery""?";Каков адрес расположения «Великобритания галерея»?
5818;"Find the address of the location named ""UK Gallery"".";Найдите адрес местоположения под названием «Великобритания галерея».
5819;What is the detail of the location UK Gallery?;Какова деталь в галерее Location UK?
5820;"Return the detail of the location named ""UK Gallery"".";Верните деталь местоположения под названием «Великобритания».
5821;"Which location names contain the word ""film""?";Какие названия местоположения содержат слово «фильм»?
5822;"Find all the locations whose names contain the word ""film"".";Найдите все локации, чьи имена содержат слово «фильм».
5823;How many distinct names are associated with all the photos?;Сколько отдельных имен связано со всеми фотографиями?
5824;Count the number of distinct names associated with the photos.;Подсчитайте количество отдельных имен, связанных с фотографиями.
5825;What are the distinct visit dates?;Каковы четкие даты посещения?
5826;Find all the distinct visit dates.;Найдите все отчетливые даты посещения.
5827;What are the names of the tourist attractions that can be accessed by bus?;Как называют туристические достопримечательности, которые можно получить на автобусе?
5828;Which tourist attractions can we get to by bus? Tell me the names of the attractions.;Какие туристические достопримечательности мы можем добраться на автобусе? Скажите мне имена аттракционов.
5829;What are the names and opening hours of the tourist attractions that can be accessed by bus or walk?;Каковы имена и часы работы туристических достопримечательностей, которые можно получить на автобусе или прогулке?
5830;Find the names and opening hours of the tourist attractions that we get to by bus or walk.;Найдите имена и часы работы туристических достопримечательностей, которые мы получаем на автобусе или прогулке.
5831;What are the star rating descriptions of the hotels with price above 10000?;Каковы описания звездных рейтингов отелей с ценой выше 10000?
5832;Give me the star rating descriptions of the hotels that cost more than 10000.;Дайте мне описания отелей Star Rating, которые стоят более 10000.
5833;What are the details and opening hours of the museums?;Каковы детали и часы работы музеев?
5834;Give me the detail and opening hour for each museum.;Дайте мне детали и час открытия для каждого музея.
5835;"What is the name of the tourist attraction that is associated with the photo ""game1""?";"Как называется туристическая достопримечательность, связанная с фото ""Game1""?"
5836;"Which tourist attraction is associated with the photo ""game1""? Return its name.";"Какая туристическая достопримечательность связана с фото ""Game1""? Вернуть свое название."
5837;"What are the names and descriptions of the photos taken at the tourist attraction ""film festival""?";Каковы имена и описания фотографий, сделанных на туристической достопримечательности «кинофестиваль»?
5838;"Find the names and descriptions of the photos taken at the tourist attraction called ""film festival"".";Найдите имена и описания фотографий, сделанных на туристической достопримечательности под названием «кинофестиваль».
5839;What are the details and ways to get to tourist attractions related to royal family?;Каковы детали и способы добраться до туристических достопримечательностей, связанных с королевской семьей?
5840;Which tourist attractions are related to royal family? Tell me their details and how we can get there.;Какие туристические достопримечательности связаны с королевской семьей? Расскажите мне их детали и как мы можем туда добраться.
5841;What are the details of the shops that can be accessed by walk?;Каковы детали магазинов, к которым можно получить доступ к Walk?
5842;Find the details of the shops that can be reached by walk.;Найдите детали магазинов, которые можно добраться от Walk.
5843;"What is the name of the staff that is in charge of the attraction named ""US museum""?";Как называется персонал, отвечающий за достопримечательность под названием «Музей США»?
5844;"Tell me the name of the staff in charge of the attraction called ""US museum"".";Расскажите мне название персонала, отвечающего за достопримечательность под названием «Музей США».
5845;What are the details of the markets that can be accessed by walk or bus?;Каковы детали рынков, к которым можно получить доступ к прогулке или автобусу?
5846;Find the details of all the markets that are accessible by walk or bus.;Найдите детали всех рынков, которые доступны на прогулке или автобусе.
5847;What are the visit date and details of the visitor whose detail is 'Vincent'?;Какова дата посещения и подробности посетителя, чьи детали - «Винсент»?
5848;Find the visit date and details of the tourist whose detail is 'Vincent';Найдите дату посещения и подробности туриста, чьи детали «Винсент»
5849;Which tourist attractions does the visitor with detail 'Vincent' visit?;Какие туристические достопримечательности посетители с деталями «Винсент» визит?
5850;Show the tourist attractions visited by the tourist whose detail is 'Vincent'.;Покажите туристические достопримечательности, посещаемые туристом, чьи детали - «Винсент».
5853;Show the average price of hotels for each star rating code.;Покажите среднюю цену отелей для каждого кода рейтинга звезд.
5854;What is the average price range of hotels for each each star rating code?;Каков средний ценовой диапазон отелей для каждого кода рейтинга STAR?
5855;Show the average price of hotels for different pet policy.;Покажите среднюю цену отелей для различных полисов домашних животных.
5856;What are the average prices of hotels grouped by their pet policy.;Каковы средние цены на отели, сгруппированные по политике их домашних животных.
5857;Show the id and star rating of each hotel, ordered by its price from low to high.;Покажите рейтинг ID и звезды каждого отеля, заказанный по цене от низкой до высокой.
5858;Find the id and star rating of each hotel and sort them in increasing order of price.;Найдите идентификатор и звездный рейтинг каждого отеля и сортируйте их по увеличению ценой.
5859;Show the details of the top 3 most expensive hotels.;Покажите детали лучших 3 самых дорогих отелей.
5860;What are the details of the three most expensive hotels?;Каковы детали трех самых дорогих отелей?
5861;Show the details and star ratings of the 3 least expensive hotels.;Покажите детали и звездные рейтинги 3 наименее дорогих отелей.
5862;What are the details and star ratings of the three hotels with the lowest price ranges?;Каковы детали и звездные рейтинги трех отелей с самыми низкими ценовыми диапазонами?
5863;Show the transportation method most people choose to get to tourist attractions.;Покажите метод транспорта, который большинство людей предпочитают добраться до туристических достопримечательностей.
5864;Which transportation method is used the most often to get to tourist attractions?;Какой метод транспорта используется чаще всего, чтобы добраться до туристических достопримечательностей?
5867;Show different ways to get to attractions and the number of attractions that can be accessed in the corresponding way.;Покажите разные способы добраться до аттракционов и количество достопримечательностей, которые можно получить соответствующим образом.
5868;List all the possible ways to get to attractions, together with the number of attractions accessible by these methods.;Перечислите все возможные способы добраться до аттракционов вместе с количеством достопримечательностей, доступных этими методами.
5875;What are the names of tourist attractions that can be reached by walk or is at address 660 Shea Crescent?;Как называют туристические достопримечательности, которые можно связаться с помощью прогулки или по адресу 660 Shea Crescent?
5876;Find the names of the tourist attractions that is either accessible by walk or at address 660 Shea Crescent.;Найдите имена туристических достопримечательностей, которые доступны либо по Walk, либо по адресу 660 Shea Crescent.
5877;What are the names of the tourist attractions that have parking or shopping as their feature details?;Каковы имена туристических достопримечательностей, которые имеют парковку или покупки в качестве деталей их функции?
