0;question;question_ru
1;List the name, born state and age of the heads of departments ordered by age.;Перечислите имя, родившее состояние и возраст руководителей департаментов, заказанных по возрасту.
2;List the creation year, name and budget of each department.;Перечислите год создания, название и бюджет каждого отделения.
3;What are the maximum and minimum budget of the departments?;Каков максимальный и минимальный бюджет департаментов?
4;What is the average number of employees of the departments whose rank is between 10 and 15?;Какое среднее число сотрудников департаментов, чье звание составляет от 10 до 15 лет?
5;What are the names of the heads who are born outside the California state?;Как имена голов, которые родились за пределами штата Калифорния?
6;What are the distinct creation years of the departments managed by a secretary born in state 'Alabama'?;Каковы явные годы создания департаментов, управляемых секретарем, родившимся в штате «Алабама»?
7;What are the names of the states where at least 3 heads were born?;Каковы имена штатов, где родились не менее 3 голов?
8;In which year were most departments established?;В каком году было создано большинство департаментов?
9;Show the name and number of employees for the departments managed by heads whose temporary acting value is 'Yes'?;Покажите имя и количество сотрудников для департаментов, управляемых руководителями, чье временное исполнительное значение - «да»?
10;How many acting statuses are there?;Сколько существует статусов актерского мастерства?
12;What are the distinct ages of the heads who are acting?;Каковы явные возрасты голов, которые играют?
14;Which department has more than 1 head at a time? List the id, name and the number of heads.;В каком отделе более 1 головы за раз? Перечислите идентификатор, имя и количество голов.
15;Which head's name has the substring 'Ha'? List the id and name.;У какого имени головы подстроение «ха»? Перечислите идентификатор и имя.
16;How many farms are there?;Сколько там ферм?
17;Count the number of farms.;Подсчитайте количество ферм.
18;List the total number of horses on farms in ascending order.;Перечислите общее количество лошадей на фермах в порядке возрастания.
19;What is the total horses record for each farm, sorted ascending?;Какова общая запись лошадей для каждой фермы, отсортирована?
20;"What are the hosts of competitions whose theme is not ""Aliens""?";Каковы хозяева соревнования, чья тема не является «инопланетянами»?
21;Return the hosts of competitions for which the theme is not Aliens?;Верните хозяев соревнований, для которых тема не инопланетяне?
22;What are the themes of farm competitions sorted by year in ascending order?;Каковы темы соревнований на ферме, отсортированные по году в порядке возрастания?
23;Return the themes of farm competitions, sorted by year ascending.;Верните темы соревнований на ферме, отсортированные по годовым восходящим.
24;What is the average number of working horses of farms with more than 5000 total number of horses?;Какое среднее количество рабочих лошадей ферм с более чем 5000 лошадей?
25;Give the average number of working horses on farms with more than 5000 total horses.;Дайте среднее количество рабочих лошадей на фермах с более чем 5000 лошадей.
26;What are the maximum and minimum number of cows across all farms.;Какое максимальное и минимальное количество коров на всех фермах.
27;Return the maximum and minimum number of cows across all farms.;Вернуть максимальное и минимальное количество коров на всех фермах.
28;How many different statuses do cities have?;Сколько разных статусов?
29;Count the number of different statuses.;Подсчитайте количество разных статусов.
30;List official names of cities in descending order of population.;Перечислите официальные имена городов в порядке убывания населения.
31;What are the official names of cities, ordered descending by population?;Каковы официальные названия городов, приказанные спуститься по населению?
32;List the official name and status of the city with the largest population.;Перечислите официальное название и статус города с самым большим населением.
33;What is the official name and status of the city with the most residents?;Какое официальное название и статус города с большинством жителей?
34;Show the years and the official names of the host cities of competitions.;Покажите годы и официальные имена принимающих городов соревнований.
35;Give the years and official names of the cities of each competition.;Дайте годы и официальные названия городов каждого соревнования.
40;Please show the themes of competitions with host cities having populations larger than 1000.;Пожалуйста, покажите темы соревнований с хозяевами, в которых население больше 1000.
41;What are the themes of competitions that have corresponding host cities with more than 1000 residents?;Каковы темы соревнований, в которых есть соответствующие города -хозяева с более чем 1000 жителей?
42;Please show the different statuses of cities and the average population of cities with each status.;Пожалуйста, покажите различные статусы городов и среднее население городов с каждым статусом.
43;What are the statuses and average populations of each city?;Каковы статусы и средние популяции каждого города?
44;Please show the different statuses, ordered by the number of cities that have each.;Пожалуйста, покажите различные статусы, заказанные количеством городов, в которых есть каждый.
45;Return the different statuses of cities, ascending by frequency.;Вернуть различные статусы городов, восходящие по частоте.
46;List the most common type of Status across cities.;Перечислите наиболее распространенный тип статуса в разных городах.
47;What is the most common status across all cities?;Какой самый распространенный статус во всех городах?
52;Find the official names of cities with population bigger than 1500 or smaller than 500.;Найдите официальные названия городов с населением, превышающим 1500 или меньше, чем 500.
53;What are the official names of cities that have population over 1500 or less than 500?;Каковы официальные названия городов, в которых население более 1500 или менее 500?
56;which course has most number of registered students?;В каком курсе большинство зарегистрированных студентов?
57;What is the name of the course with the most registered students?;Как называется курс с наиболее зарегистрированными студентами?
58;what is id of students who registered some courses but the least number of courses in these students?;Что такое удостоверение личности студентов, которые зарегистрировали некоторые курсы, но наименьшее количество курсов в этих студентах?
59;What are the ids of the students who registered for some courses but had the least number of courses for all students?;Каковы идентификаторы студентов, которые зарегистрировались на некоторые курсы, но имели наименьшее количество курсов для всех студентов?
60;what are the first name and last name of all candidates?;Какое имя и фамилия всех кандидатов?
61;What are the first and last names of all the candidates?;Каковы первые и фамилии всех кандидатов?
64;List the id of students who attended some courses?;Перечислите удостоверение личности студентов, которые посетили некоторые курсы?
65;What are the ids of all students who have attended at least one course?;Каковы идентификаторы всех студентов, которые посетили хотя бы один курс?
66;What are the ids of all students for courses and what are the names of those courses?;Каковы идентификаторы всех студентов для курсов и как имена этих курсов?
67;What is detail of the student who most recently registered course?;Каковы подробности студента, который недавно зарегистрировал курс?
68;What details do we have on the students who registered for courses most recently?;Какие детали у нас есть на студентах, которые зарегистрировались на курсы совсем недавно?
69;How many students attend course English?;Сколько студентов посещают курс английского?
70;How many students are attending English courses?;Сколько студентов посещают курсы английского языка?
71;How many courses do the student whose id is 171 attend?;Сколько курсов посещает студент, чей идентификатор посещает 171?
72;How many courses does the student with id 171 actually attend?;Сколько курсов на самом деле посещает студент с ID 171?
73;Find id of the candidate whose email is stanley.monahan@example.org?;Найдите удостоверение личности кандидата, чье электронное письмо - stanley.monahan@example.org?
74;What is the id of the candidate whose email is stanley.monahan@example.org?;Что такое идентификатор кандидата, чье электронное письмо - stanley.monahan@example.org?
75;Find id of the candidate who most recently accessed the course?;Найти удостоверение личности кандидата, который недавно получил доступ к курсу?
76;What is the id of the candidate who most recently accessed the course?;Что такое идентификатор кандидата, который недавно получил доступ к курсу?
77;What is detail of the student who registered the most number of courses?;Каковы подробности студента, который зарегистрировал наибольшее количество курсов?
78;What are the details of the student who registered for the most number of courses?;Каковы подробности студента, который зарегистрировался на наибольшее количество курсов?
79;List the id of students who registered some courses and the number of their registered courses?;Перечислите идентификатор студентов, которые зарегистрировали некоторые курсы и количество их зарегистрированных курсов?
80;For every student who is registered for some course, how many courses are they registered for?;Для каждого студента, который зарегистрирован на какой -то курс, сколько курсов они зарегистрированы?
83;"Find id of candidates whose assessment code is ""Pass""?";Найти идентификатор кандидатов, чей код оценки - «проход»?
84;What are the ids of the candidates that have an outcome code of Pass?;Каковы идентификаторы кандидатов, у которых есть код пропуска?
85;"Find the cell mobile number of the candidates whose assessment code is ""Fail""?";Найдите номер мобильного мобильного телефона кандидатов, код оценки которого «провал»?
86;"What are the cell phone numbers of the candidates that received an assessment code of ""Fail""?";Каковы номера мобильных телефонов кандидатов, которые получили код оценки «провал»?
87;What are the id of students who registered course 301?;Что такое удостоверение личности студентов, которые зарегистрировали курс 301?
88;What are the ids of the students who registered for course 301?;Каковы идентификаторы студентов, которые зарегистрировались на курс 301?
89;What is the id of the student who most recently registered course 301?;Что такое удостоверение личности студента, который недавно зарегистрировал курс 301?
90;What are the ids of the students who registered for course 301 most recently?;Каковы идентификаторы студентов, которые зарегистрировались на курс 301 в последнее время?
91;Find distinct cities of addresses of people?;Найти отдельные города адресов людей?
92;What are the different cities where people live?;В каких разных городах живут люди?
93;Find distinct cities of address of students?;Найти отдельные города адреса студентов?
94;What are the different cities where students live?;Какие города живут в разных городах?
95;List the names of courses in alphabetical order?;Перечислите имена курсов в алфавитном порядке?
96;What are the names of the courses in alphabetical order?;Как называются курсы в алфавитном порядке?
97;List the first names of people in alphabetical order?;Перечислите первые имена людей в алфавитном порядке?
98;What are the first names of the people in alphabetical order?;Какие имена людей в алфавитном порядке?
101;Find the id of courses which are registered or attended by student whose id is 121?;Найдите идентификатор курсов, которые зарегистрированы или посещают студент, чей идентификатор - 121?
102;What are the ids of the courses that are registered or attended by the student whose id is 121?;Каковы идентификаторы курсов, которые зарегистрированы или посещают студент, чей идентификатор - 121?
105;List the id of students who registered course statistics in the order of registration date.;Перечислите идентификатор студентов, которые зарегистрировали статистику курса в приказ о дате регистрации.
106;What are the ids of the students who registered course statistics by order of registration date?;Каковы идентификаторы студентов, которые зарегистрировали статистику курса по приказу регистрации?
107;List the id of students who attended  statistics courses in the order of attendance date.;Перечислите удостоверение личности студентов, которые посещали курсы статистики в дату посещения.
108;What are the ids of the students who attended courses in the statistics department in order of attendance date.;Каковы идентификаторы студентов, которые посещали курсы в отделе статистики в порядке посещаемости.
109;Give me the dates when the max temperature was higher than 85.;Дайте мне даты, когда максимальная температура была выше 85.
110;What are the dates with a maximum temperature higher than 85?;Какие даты с максимальной температурой выше 85?
111;What are the names of stations that have latitude lower than 37.5?;Каковы названия станций, которые имеют широту ниже 37,5?
112;What are the names of all stations with a latitude smaller than 37.5?;Как названия всех станций с широтой меньше 37,5?
113;For each city, return the highest latitude among its stations.;Для каждого города верните самую высокую широту среди своих станций.
114;For each city, what is the highest latitude for its stations?;Для каждого города, какова самая высокая широта для его станций?
117;What is the average latitude and longitude of stations located in San Jose city?;Какова средняя широта и долгота станций, расположенных в городе Сан -Хосе?
118;What is the average latitude and longitude in San Jose?;Какова средняя широта и долгота в Сан -Хосе?
123;For each zip code, return the average mean temperature of August there.;Для каждого почтового индекса верните среднюю среднюю температуру августа.
124;For each zip code, what is the average mean temperature for all dates that start with '8'?;Для каждого почтового индекса какова средняя средняя температура для всех дат, которые начинаются с «8»?
127;What is the number of distinct cities the stations are located at?;Какое количество отдельных городов, в которых расположены станции?
128;How many different cities have these stations?;Сколько разных городов есть эти станции?
129;How many stations does Mountain View city has?;Сколько станций у Mountain View City?
130;How many stations are in Mountain View?;Сколько станций находится в Mountain View?
131;Return the unique name for stations that have ever had 7 bikes available.;Верните уникальное имя для станций, на которых когда -либо было 7 велосипедов.
132;What are the different names for each station that has ever had 7 bikes available?;Каковы различные названия для каждой станции, на которой когда -либо было 7 велосипедов?
137;How many days had both mean humidity above 50 and mean visibility above 8?;Сколько дней имело оба влажность выше 50 и средняя видимость выше 8?
138;What is the number of days that had an average humity above 50 and an average visibility above 8?;Какое количество дней, которое имело среднее смиренность выше 50 и средняя видимость выше 8?
145;What is the 3 most common cloud cover rates in the region of zip code 94107?;Каковы 3 наиболее распространенные показатели облачного покрытия в области почтового индекса 94107?
146;What are the 3 most common cloud covers in the zip code of 94107?;Каковы 3 наиболее распространенных облачных покрытий в почтовом индексе 94107?
147;What is the zip code in which the average mean sea level pressure is the lowest?;Какой почтовый индекс, в котором среднее среднее давление на уровне моря является самым низким?
148;What is the zip code that has the lowest average mean sea level pressure?;Какой почтовый индекс имеет самое низкое среднее среднее давление на уровне моря?
153;When and in what zip code did max temperature reach 80?;Когда и в каком почтовом индексе максимальная температура достигла 80?
154;What zip codes have a station with a max temperature greater than or equal to 80 and when did it reach that temperature?;Какие почтовые индексы имеют станцию ​​с максимальной температурой, превышающей или равны 80 и когда она достигла этой температуры?
157;For each zip code, return how many times max wind speed reached 25?;Для каждого почтового индекса верните, сколько раз максимальная скорость ветра достигала 25?
158;For each zip code, how many times has the maximum wind speed reached 25 mph?;Для каждого почтового индекса сколько раз максимальная скорость ветра достигала 25 миль в час?
167;In zip code 94107, on which day neither Fog nor Rain was not observed?;В почтовом индексе 94107, в какой день ни туман, ни дождь не не наблюдались?
168;On which day has it neither been foggy nor rained in the zip code of 94107?;В какой день он не был туманным и не был дождь в почтовом индексе 94107?
173;What are the name, latitude, and city of the station with the lowest latitude?;Какое название, широта и город станции с самой низкой широтой?
174;What is the name, latitude, and city of the station that is located the furthest South?;Как называется название, широта и город станции, который находится на самом дальнем юге?
175;What are the date, mean temperature and mean humidity for the top 3 days with the largest max gust speeds?;Какова дата, средняя температура и средняя влажность для лучших 3 дней с наибольшей максимальной скоростью порыва?
176;What is the date, average temperature and mean humidity for the days with the 3 largest maximum gust speeds?;Какова дата, средняя температура и средняя влажность для дней с 3 крупнейшими максимальными скоростями порыва?
177;List the name and the number of stations for all the cities that have at least 15 stations.;Перечислите имя и количество станций для всех городов, в которых есть не менее 15 станций.
178;What is the name of every city that has at least 15 stations and how many stations does it have?;Как называется каждый город, в котором есть не менее 15 станций и сколько станций у него?
181;Find the zip code in which the average mean visibility is lower than 10.;Найдите почтовый индекс, в котором средняя средняя видимость ниже 10.
182;For each zip code, select all those that have an average mean visiblity below 10.;Для каждого почтового индекса выберите все те, которые имеют среднюю среднюю визублию ниже 10.
