0;question;question_ru
3885;Tell me the highest, lowest, and average cost of procedures.;Расскажите мне самую высокую, самую низкую и среднюю стоимость процедур.
3886;List the name and cost of all procedures sorted by the cost from the highest to the lowest.;Перечислите имя и стоимость всех процедур, отсортированных по стоимости с самой высокой до самого низкого.
3887;Sort the list of names and costs of all procedures in the descending order of cost.;Сортируйте список имен и затрат всех процедур в порядке убывания затрат.
3888;Find the three most expensive procedures.;Найдите три самых дорогих процедурах.
3889;What are the three most costly procedures?;Каковы три наиболее дорогостоящие процедуры?
3890;Find the physicians who are trained in a procedure that costs more than 5000.;Найдите врачей, которые обучены процедуре, которая стоит более 5000.
3891;Which physicians are trained in procedures that are more expensive than 5000?;Какие врачи обучены процедурам, которые дороже 5000?
3892;Find the physician who was trained in the most expensive procedure?;Найдите врача, который обучался самой дорогой процедуре?
3893;Which physician was trained in the procedure that costs the most.;Какой врач был обучен процедуре, которая стоит больше всего.
3894;What is the average cost of procedures that physician John Wen was trained in?;Какова средняя стоимость процедур, в которых был обучен врач Джон Вэнь?
3895;Compute the mean price of procedures physician John Wen was trained in.;Вычислите среднюю цену процедур, в котором был обучен врач Джон Вэнь.
3896;Find the names of procedures which physician John Wen was trained in.;Найдите названия процедур, в которые был обучен врач Джон Вэнь.
3897;What are the names of procedures physician John Wen was trained in?;Как обучались имена процедур, которые врач Джон Вэнь?
3906;Find the name of physicians who are affiliated with Surgery or Psychiatry department.;Найдите имя врачей, которые связаны с хирургическим или психиатрическим отделом.
3907;Which physicians are affiliated with either Surgery or Psychiatry department? Give me their names.;Какие врачи связаны с отделом хирургии или психиатрии? Дайте мне их имена.
3914;Find the names of nurses who are on call.;Найдите имена медсестер, которые на вызове.
3915;What are the distinct names of nurses on call?;Каковы четкие имена медсестер по вызову?
3916;How many ships are there?;Сколько там кораблей?
3917;What is the number of ships?;Какое количество кораблей?
3918;List the name of ships in ascending order of tonnage.;Перечислите название кораблей в порядке возрастания тоннажа.
3919;what are the names of the ships ordered by ascending tonnage?;Как названия кораблей заказаны под восходящим тоннажем?
3920;What are the type and nationality of ships?;Что такое тип и национальность кораблей?
3921;What are the types and nationalities of every ship?;Каковы типы и национальности каждого корабля?
3922;"List the name of ships whose nationality is not ""United States"".";Перечислите имя кораблей, национальность которых не является «Соединенными Штатами».
3923;What are the names of the ships that are not from the United States?;Как имена кораблей, которые не из Соединенных Штатов?
3924;Show the name of ships whose nationality is either United States or United Kingdom.;Покажите название кораблей, национальность которых является либо Соединенные Штаты, либо Великобритания.
3925;What are the names of the ships  that are from either the US or the UK?;Каковы имена кораблей, которые из США или Великобритании?
3926;What is the name of the ship with the largest tonnage?;Как называется корабль с самым большим тоннажем?
3927;What is the ship with the largest amount of tonnage called?;Каково судно с наибольшим количеством тоннажа?
3928;Show different types of ships and the number of ships of each type.;Покажите разные типы кораблей и количество кораблей каждого типа.
3929;For each type, how many ships are there?;Для каждого типа, сколько там кораблей?
3930;Please show the most common type of ships.;Пожалуйста, покажите наиболее распространенный тип кораблей.
3931;What is the most common type of ships?;Какой самый распространенный тип кораблей?
3932;List the nations that have more than two ships.;Перечислите нации, которые имеют более двух кораблей.
3933;What are the nations that have more than two ships?;Какие страны, у которых более двух кораблей?
3946;Find the number of students in total.;Найдите количество студентов в общей сложности.
3947;How many students are there?;Сколько там студентов?
3948;Find the last names of students studying in room 111.;Найдите фамилии студентов, обучающихся в комнате 111.
3949;What are the last names of students in room 111?;Каковы фамилии студентов в комнате 111?
3950;Find the first names of students studying in room 108.;Найдите первые имена студентов, обучающихся в комнате 108.
3951;What are the first names of students in room 108?;Какие имена студентов в комнате 108?
3952;What are the first names of students studying in room 107?;Каковы первые имена студентов, обучающихся в комнате 107?
3953;List the first names of all the students in room 107.;Перечислите первые имена всех студентов в комнате 107.
3954;For each classroom report the grade that is taught in it. Report just the classroom number and the grade number.;Для каждого класса отчет о классе, который преподается в нем. Сообщите только номер класса и номер класса.
3955;What are the grade number and classroom number of each class in the list?;Каков номер класса и номер класса каждого класса в списке?
3956;Which grade is studying in classroom 103?;Какой класс учится в классе 103?
3957;Find the grade taught in classroom 103.;Найдите оценку, преподанный в классе 103.
3958;Find the grade studying in room 105.;Найдите класс, обучающийся в комнате 105.
3959;Which grade is studying in room 105?;Какой класс учится в комнате 105?
3960;Which classrooms are used by grade 4?;Какие классные комнаты используются до 4 класса?
3961;Find the classrooms in which grade 4 is studying.;Найдите классные комнаты, в которых учится 4 класс.
3962;Which classrooms are used by grade 5?;Какие классные комнаты используются 5 классом?
3963;Show me the classrooms grade 5 is using.;Покажите мне, что классные классные класс 5 используется.
3968;Find the first names of all the teachers that teach in classroom 110.;Найдите первые имена всех учителей, которые преподают в классе 110.
3969;Which teachers teach in classroom 110? Give me their first names.;Какие учителя преподают в классе 110? Дайте мне свои имена.
3970;Find the last names of teachers teaching in classroom 109.;Найдите фамилии учителей, преподающих в классе 109.
3971;Which teachers teach in classroom 109? Give me their last names.;Какие учителя преподают в классе 109? Дайте мне их фамилии.
3972;Report the first name and last name of all the teachers.;Сообщите имя и фамилию всех учителей.
3973;What are the first name and last name of all the teachers?;Какое имя и фамилия всех учителей?
3974;Report the first name and last name of all the students.;Сообщите имя и фамилию всех студентов.
3975;Show each student's first name and last name.;Покажите имя и фамилию каждого студента.
3976;Find all students taught by OTHA MOYER. Output the first and last names of the students.;Найдите всех студентов, преподаваемых Otha Moyer. Выводит первые и фамилии студентов.
3977;Which students study under the teacher named OTHA MOYER? Give me the first and last names of the students.;Какие ученики учатся у учителя по имени Ота Мойер? Дайте мне первые и фамилии студентов.
3978;Find all students taught by MARROTTE KIRK. Output first and last names of students.;Найдите всех студентов, преподаваемых Marrotte Kirk. Вывод имени и фамилии студентов.
3979;Which are the first and last names of the students taught by MARROTTE KIRK?;Каковы первые и фамилии студентов, преподаваемых Марроттой Кирк?
3980;Find the first and last name of all the teachers that teach EVELINA BROMLEY.;Найдите первую и фамилию всех учителей, которые преподают Эвелина Бромли.
3981;Which teachers teach the student named EVELINA BROMLEY? Give me the first and last name  of the teachers.;Какие учителя учат ученика по имени Эвелина Бромли? Дайте мне первое и фамилию учителей.
3982;Find the last names of all the teachers that teach GELL TAMI.;Найдите фамилии всех учителей, которые преподают Гелл Тами.
3983;What are the last names of the teachers who teach the student called GELL TAMI?;Каковы фамилии учителей, которые учат ученика по имени Гелл Тами?
3984;How many students does LORIA ONDERSMA teaches?;Сколько студентов преподает Лория Ондерсма?
3985;Count the number of students the teacher LORIA ONDERSMA teaches.;Подсчитайте количество учеников, которым преподает учительница Лория Ондерсма.
3986;How many students does KAWA GORDON teaches?;Сколько студентов преподает Кава Гордон?
3987;Find the number of students taught by the teacher KAWA GORDON.;Найдите количество учеников, преподаваемых учителем Кава Гордон.
3988;Find the number of students taught by TARRING LEIA.;Найдите количество студентов, преподаваемых Tarring Leia.
3989;How many students are taught by teacher TARRING LEIA?;Сколько учеников преподают учительница Лейя?
3990;How many teachers does the student named CHRISSY NABOZNY have?;Сколько учителей у студента по имени Крисси Набонин?
3991;Find the number of teachers who teach the student called CHRISSY NABOZNY.;Найдите количество учителей, которые учат студента по имени Крисси Набонин.
3992;How many teachers does the student named MADLOCK RAY have?;Сколько учителей у студента по имени Мэдлок Рэй?
3993;Find the number of teachers who teach the student called MADLOCK RAY.;Найдите количество учителей, которые учат студента по имени Madlock Ray.
3996;Find the last names of the students in third grade that are not taught by COVIN JEROME.;Найдите фамилии учеников в третьем классе, которых не преподает Ковин Джером.
3997;Which students in third grade are not taught by teacher COVIN JEROME? Give me the last names of the students.;Какие ученики третьего класса не учат учительницей Ковин Джером? Дайте мне фамилии студентов.
3998;For each grade, report the grade, the number of classrooms in which it is taught and the total number of students in the grade.;Для каждого класса сообщайте о оценке, количестве классных комнат, в которых он преподается, и общее количество учащихся в классе.
3999;For each grade, return the grade number, the number of classrooms used for the grade, and the total number of students enrolled in the grade.;Для каждого класса возвращайте номер класса, количество классных комнат, используемых для оценки, и общее количество учеников, зачисленных в класс.
4000;For each classroom, report the classroom number and the number of grades using it.;Для каждой классной комнаты сообщите о номере классной комнаты и количеству сортов, использующих его.
4001;For each classroom, show the classroom number and count the number of distinct grades that use the room.;Для каждого класса покажите номер класса и подсчитайте количество отдельных сортов, которые используют комнату.
4002;Which classroom has the most students?;В каком классе больше всего ученика?
4003;Find the classroom that the most students use.;Найдите классную комнату, которую используют большинство учеников.
4004;Report the number of students in each classroom.;Сообщите количество учеников в каждом классе.
4005;For each classroom, show the classroom number and find how many students are using it.;Для каждого класса покажите номер класса и обнаружите, сколько учеников его используют.
4006;For each grade 0 classroom, report the total number of students.;Для каждого класса класса 0 сообщите об общем количестве студентов.
4007;For each grade 0 classroom, return the classroom number and the count of students.;Для каждого класса класса 0 верните номер класса и количество учеников.
4008;Report the total number of students for each fourth-grade classroom.;Сообщайте общее количество студентов для каждого класса в четвертом классе.
4009;For each fourth-grade classroom, show the classroom number and the total number of students using it.;Для каждого класса четвертого класса покажите номер класса и общее количество студентов, использующих его.
4010;Find the name of the teacher who teaches the largest number of students.;Найдите имя учителя, который преподает наибольшее количество студентов.
4011;Which teacher teaches the most students? Give me the first name and last name of the teacher.;Какой учитель учит больше всего учеников? Дайте мне имя и фамилию учителя.
4012;Find the number of students in one classroom.;Найдите количество учеников в одном классе.
4013;How many students does one classroom have?;Сколько учеников у одного класса?
4014;How many companies are headquartered in the US?;Сколько компаний со штаб -квартирой в США?
4015;List the names of companies by ascending number of sales.;Перечислите имена компаний, увеличивая количество продаж.
4016;What are the headquarters and industries of all companies?;Каковы штаб -квартира и отрасли всех компаний?
4017;Show the names of companies in the banking or retailing industry?;Показать названия компаний в банковской или розничной индустрии?
4018;What is the maximum and minimum market value of companies?;Какова максимальная и минимальная рыночная стоимость компаний?
4019;What is the headquarter of the company with the largest sales?;Какова штаб -квартира компании с самыми большими продажами?
4020;Show the different headquarters and number of companies at each headquarter.;Покажите различные штаб -квартиры и количество компаний в каждой штаб -квартире.
4021;Show the most common headquarter for companies.;Покажите наиболее распространенный штаб для компаний.
4022;Show the headquarters that have at least two companies.;Покажите штаб -квартиру, в которой есть как минимум две компании.
4024;Show the names of companies and of employees.;Покажите имена компаний и сотрудников.
4025;Show names of companies and that of employees in descending order of number of years working for that employee.;Покажите названия компаний и работников в порядке убывания в течение количества лет работы для этого сотрудника.
4026;Show the names of employees that work for companies with sales bigger than 200.;Покажите имена сотрудников, которые работают для компаний с продажами, превышающими 200.
4027;Show the names of companies and the number of employees they have;Покажите имена компаний и количество сотрудников, которые у них есть
4029;list the names of the companies with more than 200 sales in the descending order of sales and profits.;Перечислите имена компаний с более чем 200 продажами в порядок продаж и прибыли.
4030;How many film are there?;Сколько там фильма?
4031;Count the number of films.;Подсчитайте количество фильмов.
4032;List the distinct director of all films.;Перечислите отдельного режиссера всех фильмов.
4033;What are the different film Directors?;Какие режиссеры разных фильмов?
4034;What is the average ticket sales gross in dollars of films?;Какова средняя продажа билетов в долларах фильмов?
4035;Return the average gross sales in dollars across all films.;Вернуть средние валовые продажи в долларах во всех фильмах.
4036;What are the low and high estimates of film markets?;Каковы низкие и высокие оценки рынков пленки?
4037;Return the low and high estimates for all film markets.;Вернуть низкие и высокие оценки для всех пленочных рынков.
4038;What are the types of film market estimations in year 1995?;Каковы типы оценок рынка кино в 1995 году?
4039;Return the types of film market estimations in 1995.;Возврат типы оценок рынка кино в 1995 году.
4040;What are the maximum and minimum number of cities in all markets.;Какое максимальное и минимальное количество городов на всех рынках.
4041;Return the maximum and minimum number of cities across all markets.;Вернуть максимальное и минимальное количество городов на всех рынках.
4042;How many markets have number of cities smaller than 300?;Сколько рынков имеет количество городов меньше 300?
4043;Count the number of markets that have a number of cities lower than 300.;Подсчитайте количество рынков, в которых есть несколько городов ниже 300.
4044;List all countries of markets in ascending alphabetical order.;Перечислите все страны рынков в восходящем алфавитном порядке.
4045;What are the countries for each market, ordered alphabetically?;Какие страны для каждого рынка, заказанные в алфавитном порядке?
4046;List all countries of markets in descending order of number of cities.;Перечислите все страны рынков в порядке убывания количества городов.
4047;What are the countries for each market ordered by decreasing number of cities?;Каковы страны для каждого рынка, упорядоченного путем уменьшения числа городов?
4048;Please show the titles of films and the types of market estimations.;Пожалуйста, покажите названия фильмов и типов рыночных оценок.
4049;What are the titles of films and corresponding types of market estimations?;Каковы названия фильмов и соответствующих типов рыночных оценок?
4050;Show the distinct director of films with market estimation in the year of 1995.;Покажите отдельного режиссера фильмов с оценкой рынка в 1995 году.
4051;Who are the different directors of films which had market estimation in 1995?;Кто различные директора фильмов, которые имели рыночную оценку в 1995 году?
4052;What is the average number of cities of markets with low film market estimate bigger than 10000?;Какое среднее число городов рынков с низкой оценкой рынка пленки больше 10000?
4053;Give the average number of cities within markets that had a low market estimation larger than 10000?;Дайте среднее количество городов на рынках, которые имели низкую рыночную оценку, превышающую 10000?
4054;Please list the countries and years of film market estimations.;Пожалуйста, перечислите страны и годы рынка кино.
4055;What are the countries of markets and their corresponding years of market estimation?;Каковы страны рынков и их соответствующие годы рынка?
4056;"Please list the years of film market estimations when the market is in country ""Japan"" in descending order.";Пожалуйста, перечислите годы оценки рынка кино, когда рынок находится в стране «Япония» в порядке убывания.
4057;What are the years of film market estimation for the market of Japan, ordered by year descending?;Каковы годы оценки рынка кино для рынка Японии, заказанные по году спуска?
4058;List the studios of each film and the number of films produced by that studio.;Перечислите студии каждого фильма и количество фильмов, снятых этой студией.
4059;How films are produced by each studio?;Как продюсируются фильмы каждой студией?
