0;question;question_ru
2053;Return the minister who left office at the latest time.;Вернитесь министра, который покинул пост в то время.
2054;Which minister left office the latest?;Какой министр покинул пост последнего?
2055;List member names and their party names.;Список имен участников и имена их партий.
2056;What are the names of members and their corresponding parties?;Каковы имена членов и их соответствующие стороны?
2061;Show all party names and their region names.;Покажите все имена вечеринок и имена их региона.
2062;What are the names of parties and their respective regions?;Каковы имена партий и их соответствующих регионов?
2067;Show member names that are not in the Progress Party.;Показать имена участников, которые не находятся в партии прогресса.
2068;Which member names corresponding to members who are not in the Progress Party?;Какие имена участников соответствуют членам, которые не находятся в стороне прогресса?
2069;How many party events do we have?;Сколько у нас вечерительных мероприятий?
2070;Count the number of party events.;Подсчитайте количество вечеринок.
2079;find the event names that have more than 2 records.;Найдите имена событий, которые имеют более 2 записей.
2080;Which event names were used more than twice for party events?;Какие названия событий использовались более чем дважды для вечеринок?
2081;How many Annual Meeting events happened in the United Kingdom region?;Сколько ежегодных мероприятий собрания произошло в регионе Великобритании?
2082;Count the number of Annual Meeting events that took place in the region of the United Kingdom.;Подсчитайте количество ежегодных мероприятий, которые происходили в регионе Соединенного Королевства.
2083;How many pilots are there?;Сколько там пилотов?
2084;List the names of pilots in ascending order of rank.;Перечислите имена пилотов в порядке возрастания.
2085;What are the positions and teams of pilots?;Каковы позиции и команды пилотов?
2086;List the distinct positions of pilots older than 30.;Перечислите отдельные позиции пилотов старше 30 лет.
2087;"Show the names of pilots from team ""Bradley"" or ""Fordham"".";Покажите имена пилотов из команды «Брэдли» или «Фордхэм».
2088;What is the joined year of the pilot of the highest rank?;Каков объединенный год пилота самого высокого звания?
2089;What are the different nationalities of pilots? Show each nationality and the number of pilots of each nationality.;Каковы различные национальности пилотов? Покажите каждую национальность и количество пилотов каждого национальности.
2090;Show the most common nationality of pilots.;Покажите наиболее распространенную национальность пилотов.
2092;Show the names of pilots and models of aircrafts they have flied with.;Покажите имена пилотов и модели самолетов, с которыми они столкнулись.
2093;Show the names of pilots and fleet series of the aircrafts they have flied with in ascending order of the rank of the pilot.;Покажите имена пилотов и серии флотов самолетов, с которыми они столкнулись в порядке возрастания пилота.
2094;Show the fleet series of the aircrafts flied by pilots younger than 34;Покажите серию флота самолетов, пролеченных пилотами моложе 34
2095;Show the names of pilots and the number of records they have.;Покажите имена пилотов и количество записей, которые у них есть.
2096;Show names of pilots that have more than one record.;Показывают имена пилотов, у которых есть более одной записи.
2131;List all department names ordered by their starting date.;Перечислите все имена департаментов, заказанные в дате их начала.
2132;find all dependent names who have a spouse relation with some employee.;Найдите все зависимые имена, которые имеют отношение супруга с некоторым сотрудником.
2133;how many female dependents are there?;Сколько там женских иждивенцев?
2134;Find the names of departments that are located in Houston.;Найдите имена отделов, которые расположены в Хьюстоне.
2135;Return the first names and last names of employees who earn more than 30000 in salary.;Верните первые имена и фамилии сотрудников, которые зарабатывают более 30000 за зарплату.
2136;Find the number of employees of each gender whose salary is lower than 50000.;Найдите количество сотрудников каждого пола, зарплата которого ниже 50000.
2137;list the first and last names, and the addresses of all employees in the ascending order of their birth date.;Перечислите первые и фамилии, а также адреса всех сотрудников в порядке возрастания их даты рождения.
2140;How many events have each participants attended? List the participant id, type and the number.;Сколько мероприятий посещали каждый участник? Перечислите идентификатор участника, тип и номер.
2141;What are all the the participant ids, type code and details?;Каковы все идентификаторы участников, код типа и детали?
2142;How many participants belong to the type 'Organizer'?;Сколько участников принадлежат к типовому организатору?
2143;List the type of the services in alphabetical order.;Перечислите тип услуг в алфавитном порядке.
2145;How many events had participants whose details had the substring 'Dr.';Сколько мероприятий проводило участников, чьи детали имели подстроение «доктор»
2146;What is the most common participant type?;Какой самый распространенный тип участника?
2152;What are all the distinct participant ids who attended any events?;Какие идентификаторы участников, которые посещали какие -либо мероприятия?
2153;What is the name of the race held most recently?;Как называется гонка совсем недавно?
2154;What is the name of the race that occurred most recently?;Как называется гонка, которая произошла совсем недавно?
2155;What is the name and date of the most recent race?;Как называется и дата самой последней гонки?
2156;What is the name and date of the race that occurred most recently?;Какое имя и дата гонки произошли в последнее время?
2157;Find the names of all races held in 2017.;Найдите имена всех гонок, проведенных в 2017 году.
2158;What are the names of all the races that occurred in the year 2017?;Как называются все расы, которые произошли в 2017 году?
2159;Find the distinct names of all races held between 2014 and 2017?;Найти отличные имена всех рас, проведенных между 2014 и 2017 годами?
2160;What are the unique names of all race held between 2014 and 2017?;Каковы уникальные имена всех гонок между 2014 и 2017 годами?
2161;List the forename and surname of all distinct drivers who once had laptime less than 93000 milliseconds?;Перечислите имя и фамилия всех различных водителей, у которых когда -то было ночное время менее 93000 миллисекунд?
2162;What are the forenames and surnames of all unique drivers who had a lap time of less than 93000 milliseconds?;Каковы имена и фамилии всех уникальных водителей, у которых было время круга менее 93000 миллисекунд?
2163;Find all the distinct id and nationality of drivers who have had laptime more than 100000 milliseconds?;Найдите все отчетливое удостоверение личности и национальности водителей, у которых было новое время более 100000 миллисекунд?
2164;What are the different driver ids and nationalities of all drivers who had a laptime of more than 100000 milliseconds?;Каковы различные идентификаторы водителя и национальности всех водителей, у которых было новое время более 100000 миллисекунд?
2165;What are the forename and surname of the driver who has the smallest laptime?;Какое имя и фамилия водителя, у которого наименьшее ночное время?
2166;What is the forename and surname of the driver with the shortest laptime?;Какое имя и фамилия водителя с самого короткого номера?
2167;What is the id and family name of the driver who has the longest laptime?;Какова идентификация и фамилия водителя, у которого самое длинное новое время?
2168;What is the id and last name of the driver with the longest laptime?;Какова идентификатор и фамилия водителя с самым длинным но нами?
2175;Give me a list of names and years of races that had any driver whose forename is Lewis?;Дайте мне список имен и годов годов, в которых был водитель, чье правление - Льюис?
2176;What are the names and years of all races that had a driver with the last name Lewis?;Какие имена и годы всех рас, у которых был водитель с фамилией Льюис?
2177;Find the forename and surname of drivers whose nationality is German?;Найдите передвижение и фамилию водителей, чье национальность немецкая?
2178;What is the first and last name of all the German drivers?;Как первое и фамилия всех немецких водителей?
2183;Find all the forenames of distinct drivers who was in position 1 as standing and won?;Найдите все передвижения отдельных водителей, которые были в позиции 1 в качестве стоящего и выигравшего?
2184;What are all the different first names of the drivers who are in position as standing and won?;Каковы все разные имена водителей, которые находятся в положении в качестве стоящих и выигранных?
2185;Find all the forenames of distinct drivers who won in position 1 as driver standing and had more than 20 points?;Найдите все передвижения от разных водителей, которые выиграли в позиции 1 в качестве водителя, стоящего и имели более 20 очков?
2186;What are the first names of the different drivers who won in position 1 as driver standing and had more than 20 points?;Каковы первые имена разных водителей, которые выиграли в позиции 1 в качестве водителя, стоящего и имели более 20 очков?
2187;What are the numbers of constructors for different nationalities?;Каковы количество конструкторов для разных национальностей?
2188;For each nationality, how many different constructors are there?;Для каждой национальности, сколько существует различных конструкторов?
2189;What are the numbers of races for each constructor id?;Каковы количество гонок для каждого идентификатора конструктора?
2190;For each constructor id, how many races are there?;Для каждого идентификатора конструктора, сколько гонок?
2191;What are the names of races that were held after 2017 and the circuits were in the country of Spain?;Как имена гонок, которые были проведены после 2017 года, а трассы были в стране Испании?
2192;What are the names of the races held after 2017 in Spain?;Как имена гонок, проводимых после 2017 года в Испании?
2193;What are the unique names of races that held after 2000 and the circuits were in Spain?;Каковы уникальные имена гонок, которые проводились после 2000 года, а схемы были в Испании?
2194;What are the names of all races held after 2000 in Spain?;Как имена всех гонок, проводимых после 2000 года в Испании?
2199;List the forenames of all distinct drivers in alphabetical order?;Перечислите передвижения всех различных драйверов в алфавитном порядке?
2200;What are the first names of all the different drivers in alphabetical order?;Каковы первые имена всех разных драйверов в алфавитном порядке?
2201;List the names of all distinct races in reversed  lexicographic order?;Перечислите названия всех отдельных рас в обратном лексикографическом порядке?
2202;What are the different names of all the races in reverse alphabetical order?;Как разные имена всех рас в обратном алфавитном порядке?
2203;What are the names of races held between 2009 and 2011?;Как имена гонок, которые проводятся между 2009 и 2011 годами?
2204;What are the names of all races held between 2009 and 2011?;Как имена всех рас, проводящих между 2009 и 2011 годами?
2205;What are the names of races held after 12:00:00 or before 09:00:00?;Как имена гонок, проведенных после 12:00:00 или до 09:00:00?
2206;What are the names of all races that occurred after 12:00:00 or before 09:00:00?;Как имена всех рас, которые произошли после 12:00:00 или до 09:00:00?
2207;What are the drivers' first, last names and id who had more than 8 pit stops or participated in more than 5 race results?;Каковы первые водители, фамилии и удостоверение личности, у которых было более 8 пит -стоп или участвовал в более чем 5 результатах гонки?
2208;What are the drivers' first names,last names, and ids for all those that had more than 8 stops or participated in more than 5 races?;Каковы имена водителей, фамилии и удостоверения личности для всех, у которых было более 8 остановок или участвовало в более чем 5 гонках?
2211;What is the id and last name of the driver who participated in the most races after 2010?;Что такое идентификатор и фамилия водителя, который участвовал в большинстве гонок после 2010 года?
2212;What is the id and last name of the driver who participated in the most races after 2010?;Что такое идентификатор и фамилия водителя, который участвовал в большинстве гонок после 2010 года?
2213;What are the names of circuits that belong to UK or Malaysia?;Каковы имена кругов, которые принадлежат Великобритании или Малайзии?
2214;What are the names of all the circuits that are in the UK or Malaysia?;Как называются все круги, которые находятся в Великобритании или Малайзии?
2215;Find the id and location of circuits that belong to France or Belgium?;Найти идентификатор и местоположение цепей, принадлежащих Франции или Бельгии?
2216;What are the ids and locations of all circuits in France or Belgium?;Каковы идентификаторы и местоположения всех схем во Франции или Бельгии?
2217;Find the names of Japanese constructors that have once earned more than 5 points?;Найти имена японских конструкторов, которые когда -то заработали более 5 баллов?
2218;What are the names of all the Japanese constructors that have earned more than 5 points?;Как называют все японские конструкторы, которые заработали более 5 очков?
2221;What is the maximum fastest lap speed in race named 'Monaco Grand Prix' in 2008 ?;Какая максимальная скорость круга в гонке под названием «Гран -при Монако» в 2008 году?
2222;What is the maximum fastest lap speed in the Monaco Grand Prix in 2008?;Какая максимальная скорость круга в Гран -при Монако в 2008 году?
2227;Find the id, forename and number of races of all drivers who have at least participated in two races?;Найдите удостоверение личности, ловкость и количество гонок всех водителей, которые, по крайней мере, участвовали в двух гонках?
2228;What is the id, forename, and number of races for all drivers that have participated in at least 2 races?;Что такое удостоверение личности, логическое имя и количество гонок для всех водителей, которые участвовали как минимум в 2 гонках?
2229;Find the driver id and number of races of all drivers who have at most participated in 30 races?;Найдите идентификатор водителя и количество гонок всех водителей, которые в большинстве участвовали в 30 гонках?
2230;For each id of a driver who participated in at most 30 races, how many races did they participate in?;Для каждого идентификатора водителя, который участвовал не более 30 гонок, в каких гонках они участвовали?
2231;Find the id and surname of the driver who participated the most number of races?;Найдите идентификатор и фамилию водителя, который участвовал в наибольшее количество гонок?
2232;What are the ids and last names of all drivers who participated in the most races?;Каковы идентификаторы и фамилии всех водителей, которые участвовали в большинстве гонок?
2233;How many technicians are there?;Сколько там техников?
2234;What is the number of technicians?;Какое количество техников?
2235;List the names of technicians in ascending order of age.;Перечислите имена технических специалистов в восходящем порядке возраста.
2236;What are the names of the technicians by ascending order of age?;Как называются технические специалисты, восходящая порядок возраста?
2237;What are the team and starting year of technicians?;Какова команда и начальный год техников?
2238;What is the team and starting year for each technician?;Какова команда и начальный год для каждого техника?
2239;"List the name of technicians whose team is not ""NYY"".";"Перечислите имя техников, чья команда не ""NYY""."
2240;What is the name of the technician whose team is not 'NYY'?;Как называется техник, чья команда не «nyy»?
2241;Show the name of technicians aged either 36 or 37;Покажите название техников в возрасте 36 или 37
2242;What are the names of the technicians aged either 36 or 37?;Как называются технические специалисты в возрасте 36 или 37?
2243;What is the starting year of the oldest technicians?;Каков начальный год самых старых техников?
2244;What is the starting year for the oldest technician?;Какой стартовый год для самого старейшего техника?
2245;Show different teams of technicians and the number of technicians in each team.;Покажите разные команды техников и количество техников в каждой команде.
2246;For each team, how many technicians are there?;Для каждой команды, сколько там техников?
2247;Please show the team that has the most number of technicians.;Пожалуйста, покажите команду, в которой больше всего специалистов.
2248;What are the teams with the most technicians?;Какие команды с большинством техников?
2249;Show the team that have at least two technicians.;Покажите команду, у которой есть как минимум два техника.
2250;What is the team with at least 2 technicians?;Что такое команда с по крайней мере 2 техническими специалистами?
2251;Show names of technicians and series of machines they are assigned to repair.;Показывают названия техников и серии машин, которые они назначены для ремонта.
2252;What are the names of technicians and the machine series that they repair?;Как названия техников и серии машин, которые они ремонтируют?
2253;Show names of technicians in ascending order of quality rank of the machine they are assigned.;Покажите названия техников в восходящем порядке качественного ранга машины, которую они назначены.
2254;What are the names of the technicians by ascending order of quality rank for the machine they are assigned?;Как называются технические специалисты, поднимаясь по порядку качественного ранга для машины, которую они назначены?
2255;Show names of technicians who are assigned to repair machines with value point more than 70.;Покажите названия технических специалистов, которым назначается ремонтные машины с точкой стоимости более 70.
2256;What are the names of the technicians that are assigned to repair machines with more point values than 70?;Как названия техников, которые назначаются для ремонтных машин с большим количеством точечных значений, чем 70?
2257;Show names of technicians and the number of machines they are assigned to repair.;Показывают названия техников и количество машин, которые они назначены для ремонта.
2258;What are the names of the technicians  and how many machines are they assigned to repair?;Как называются технические специалисты и сколько машин они назначены для ремонта?
2263;How many entrepreneurs are there?;Сколько существует предпринимателей?
